{
  "$schema": "../../schemas/v1/spellcaster.schema.json",
  "spellcaster_id": "stone_shaman",
  "name": "Stone Shaman",
  "class": "Enchanter",
  "category": "Spellcaster",
  "movement_type": "Ground",
  "image_required": true,
  "difficulty": 2,
  "abilities": {
    "passive": [
      {
        "name": "Mountain\u2019s Favor",
        "description": "The Stone Shaman\u2019s attacks deal double damage to buildings."
      },
      {
        "name": "Child of the Titans",
        "description": "Increases Rank II and Rank III population while reducing Rank I population."
      },
      {
        "name": "Pathfinder",
        "description": "While on the ground, the Shaman recharges Wild incantations much faster."
      }
    ],
    "primary": {
      "name": "Mountain Staff",
      "description": "Swing your catalyst to deal heavy melee damage and interrupt enemies.",
      "mechanics": {
        "features": [
          {
            "name": "Interruption",
            "description": "Successfully hitting a Spellcaster twice interrupts their actions."
          }
        ],
        "aura": [
          {
            "name": "Building Enchant",
            "description": "Attacks enchant ally buildings, enabling them to emit a healing aura.",
            "radius": 8,
            "value": 7,
            "effect": "Heal",
            "target_type": "Ally",
            "interval": 1.0
          }
        ]
      }
    },
    "defense": {
      "name": "Wind Shield",
      "description": "Conjure a protective wind barrier that deals damage on contact.",
      "stats": {
        "charges": null,
        "duration": null
      }
    },
    "ultimate": {
      "name": "Wall of Kamazad",
      "description": "Deploys a colossal wall capable of blocking Titans.",
      "stats": {
        "duration": null,
        "damage": null
      }
    }
  },
  "last_modified": "2026-02-10T00:28:41.370274+00:00",
  "changelog": [
    {
      "version": "0.0.1",
      "date": "2026-02-05T18:35:34.217480Z",
      "description": "Initial Closed Beta 2 Data"
    }
  ]
}
