{
  "$schema": "../../schemas/v1/spellcaster.schema.json",
  "spellcaster_id": "iron_sorcerer",
  "name": "Iron Sorcerer",
  "class": "Conqueror",
  "category": "Spellcaster",
  "image_required": true,
  "difficulty": 1,
  "abilities": {
    "passive": [
      {
        "name": "Scourge of War",
        "description": "Increases Rank III population, reduces Rank II population."
      },
      {
        "name": "Forges of Valm",
        "description": "Creatures spawned from Buildings have significantly more health."
      },
      {
        "name": "Field Commander",
        "description": "While on the ground, nearby WAR creatures gain a strong defensive buff."
      }
    ],
    "primary": {
      "name": "Twin Strike",
      "description": "Strike with powerful mid-range attacks that interrupt enemies."
    },
    "defense": {
      "name": "Rune Shield",
      "description": "Raise a shield that protects allies and reflects attacks."
    },
    "ultimate": {
      "name": "Iron Tempest",
      "description": "Unleash a metal vortex that deals heavy damage and knocks back enemies along its path."
    }
  },
  "last_modified": "2026-02-05T18:34:58.970266Z",
  "changelog": [
    {
      "version": "0.0.1",
      "date": "2026-02-05T18:34:58.970266Z",
      "description": "Initial Closed Beta 2 Data"
    }
  ]
}