{
  "$schema": "../../schemas/v1/spellcaster.schema.json",
  "spellcaster_id": "mystic_scribe",
  "name": "Mystic Scribe",
  "class": "Enchanter",
  "category": "Spellcaster",
  "movement_type": "Ground",
  "image_required": true,
  "difficulty": 2,
  "abilities": {
    "passive": [
      {
        "name": "Echo of Mercy",
        "description": "While on the ground, the Mystic Scribe emits a healing aura."
      },
      {
        "name": "Holy Magic Mastery",
        "description": "All Holy incantations recharge faster."
      },
      {
        "name": "Thousand Favors",
        "description": "Healing recharges Rank I and II creatures."
      }
    ],
    "primary": {
      "name": "Brush Strike",
      "description": "Strike with enchanted ink to damage enemies and boost allies\u2019 Max HP."
    },
    "defense": {
      "name": "Scroll Barrier",
      "description": "Creates a barrier that absorbs projectiles and reduces all damage. Absorbing projectiles refreshes Holy spells."
    },
    "ultimate": {
      "name": "Seal of Immortality",
      "description": "Mark the ground with a massive healing seal."
    }
  },
  "last_modified": "2026-02-10T02:13:29.491541+00:00",
  "changelog": [
    {
      "version": "0.0.1",
      "date": "2026-02-05T18:33:10.223377Z",
      "description": "Initial Closed Beta 2 Data"
    }
  ]
}
